<?xml version="1.0" encoding="utf-8"?>
<Demo Name="Parser" xmlns:xsi="http://www.w3.org/2001/XMLSchema-instance"
  xsi:noNamespaceSchemaLocation="../../../lib/grunt/schema.xsd">
  <Description>Parser sandbox</Description>
  <Main>index.jade</Main>
 
  <PropertyGroup>
    <DestFolder>../../../$(BuiltDir)/demos/parser-sandbox/</DestFolder>
    <Dependencies>
      <Module Name="parser" />
      <Attachment>
        <File Path="patch.js"/>
        <Type>javascript</Type>
        <Format>Enclosure</Format>
      </Attachment>
      <Attachment>
        <File Path="test_files.js"/>
        <Type>javascript</Type>
        <Format>Enclosure</Format>
      </Attachment>
      <Attachment>
        <Folder Path="CodeMirror-2.23"/>
        <Format>Enclosure</Format>
      </Attachment>
      <Attachment>
        <File Path="CodeMirror-2.23/lib/codemirror.js"/>
        <Type>javascript</Type>
        <Format>Enclosure</Format>
      </Attachment>
      <Attachment>
        <File Path="CodeMirror-2.23/mode/clike/clike.js"/>
        <Type>javascript</Type>
        <Format>Enclosure</Format>
      </Attachment>
      <Attachment>
        <File Path="CodeMirror-2.23/lib/codemirror.css"/>
        <Type>css</Type>
        <Format>Enclosure</Format>
      </Attachment>
    </Dependencies>
  </PropertyGroup>
</Demo>
