<?xml version="1.0" encoding="utf-8"?>
<Project xmlns:xsi="http://www.w3.org/2001/XMLSchema-instance"
  xsi:noNamespaceSchemaLocation="../../../lib/grunt/schema.xsd">
  <ItemGroup>
    <TypeScriptCompile Include="progress.ts"/>
  </ItemGroup>
  <PropertyGroup>
    <TypeScriptOutFile>../../../$(BuiltDir)/$(Configuration)/addons/progress.addon.js</TypeScriptOutFile>
    <TypeScriptTarget>ES3</TypeScriptTarget>
    <TypeScriptPropagateEnumConstants>True</TypeScriptPropagateEnumConstants>
    <TypeScriptGeneratesDeclarations>True</TypeScriptGeneratesDeclarations>
    <TypeScriptDeclarationDir>../../../$(BuiltDir)/Lib</TypeScriptDeclarationDir>
    <Dependencies>
      <Module Name="core" />
    </Dependencies>
    <!--<Variable Name="AE_DEBUG">'$(Configuration)' == 'Debug'</Variable>-->
  </PropertyGroup>
  <PropertyGroup Condition="'$(Configuration)' == 'Debug'">
    <Dependencies>
      <Attachment>
        <Folder Path="progress/debug" />
        <Format>Enclosure</Format>
      </Attachment>
    </Dependencies>
  </PropertyGroup>
  <PropertyGroup Condition="'$(Configuration)' == 'Release'">
    <Dependencies>
      <Attachment>
        <Folder Path="progress/release" />
        <Format>Enclosure</Format>
      </Attachment>
    </Dependencies>
    <ClosureCompiler>
      <CompilationLevel>ADVANCED_OPTIMIZATIONS</CompilationLevel>
      <CreateSourceMap>False</CreateSourceMap>
    </ClosureCompiler>
  </PropertyGroup>
</Project>
