<?xml version="1.0" encoding="utf-8"?>
<Project xmlns:xsi="http://www.w3.org/2001/XMLSchema-instance"
  xsi:noNamespaceSchemaLocation="../../../lib/grunt/schema.xsd">
  <ItemGroup>
    <TypeScriptCompile Include="navigation.ts"/>
  </ItemGroup>
  <PropertyGroup>
    <TypeScriptOutFile>../../../$(BuiltDir)/addons/navigation.addon.js</TypeScriptOutFile>
    <TypeScriptTarget>ES3</TypeScriptTarget>
    <TypeScriptPropagateEnumConstants>True</TypeScriptPropagateEnumConstants>
    <TypeScriptGeneratesDeclarations>True</TypeScriptGeneratesDeclarations>
    <TypeScriptDeclarationDir>../../../$(BuiltDir)/../Lib</TypeScriptDeclarationDir>
    <Dependencies>
      <Module Name="core" />
    </Dependencies>
  </PropertyGroup>
  <PropertyGroup Condition="'$(Configuration)' == 'Debug'">
    <Resource Name="AE_NAVIGATION_DEPENDENCIES">
      <Filename>navigation.addon</Filename>
      <Archive>True</Archive>
      <UseInlining>False</UseInlining>
      <Data>
        <Folder Path="navigation">
          <Exclude Path="cubemap.psd" />
        </Folder>
        <ResourceFile Path="navigation/cube.dae"
                  Name="akra.navigation.ORIENTATION_CUBE"
                  Comment="Model of orientation cube."/>
      </Data>
    </Resource>
  </PropertyGroup>
  <PropertyGroup Condition="'$(Configuration)' == 'Release'">
    <ClosureCompiler>
      <CompilationLevel>ADVANCED_OPTIMIZATIONS</CompilationLevel>
      <CreateSourceMap>False</CreateSourceMap>
    </ClosureCompiler>
    <Resource Name="AE_NAVIGATION_DEPENDENCIES">
      <Archive>True</Archive>
      <UseInlining>True</UseInlining>
      <Data>
        <Folder Path="navigation">
          <Exclude Path="cubemap.psd" />
        </Folder>
        <ResourceFile Path="navigation/cube.dae"
                  Name="akra.navigation.ORIENTATION_CUBE" />
      </Data>
    </Resource>
  </PropertyGroup>
</Project>

