<?xml version="1.0" encoding="utf-8"?>
<Demo Name="Anti-aliasing" xmlns:xsi="http://www.w3.org/2001/XMLSchema-instance"
  xsi:noNamespaceSchemaLocation="../../../lib/grunt/schema.xsd">
  <Description>Anti-aliasing test demo.</Description>
  <ItemGroup>
    <TypeScriptCompile Include="anti-aliasing.ts"/>
  </ItemGroup>
  <PropertyGroup>
    <TypeScriptOutFile>../../../$(BuiltDir)/demos/anti-aliasing/anti-aliasing.js</TypeScriptOutFile>
    <TypeScriptPropagateEnumConstants>True</TypeScriptPropagateEnumConstants>
    <Dependencies>
      <Attachment>
        <File Path="dat.gui/dat.gui.min.js"/>
        <Format>Enclosure</Format>
        <OutDir>js</OutDir>
        <Type>javascript</Type>
        <CollapsePath>True</CollapsePath>
      </Attachment>
      
      <Module Name="addon-progress" />
      <Module Name="addon-base3dObjects" />
      
    </Dependencies>
    <Resource Name="AE_RESOURCES">
      <Filename>data</Filename>
      <Archive>False</Archive>
      <UseInlining>False</UseInlining>
      <Data>
        <Folder Path="data"/>

        <ResourceFile Path="data/models/teapot.DAE" Name="TEAPOT.DAE"/>
        <ResourceFile Path="data/models/Sphere.DAE" Name="SPHERE.DAE"/>
        <ResourceFile Path="data/textures/skyboxes/nature.dds" Name="SKYBOX_NATURE"/>
        <ResourceFile Path="data/textures/skyboxes/desert-3.dds" Name="SKYBOX_DESERT"/>
        <ResourceFile Path="data/textures/skyboxes/colosseum.dds" Name="SKYBOX_COLOSSEUM"/>
        <ResourceFile Path="data/textures/skyboxes/rome-church.dds" Name="SKYBOX_CHURCH"/>
        <ResourceFile Path="data/textures/skyboxes/saint-peters-basilica.dds" Name="SKYBOX_BASILICA"/>
        <ResourceFile Path="data/textures/skyboxes/plains-of-abraham.dds" Name="SKYBOX_PLAINS"/>
        <ResourceFile Path="data/textures/skyboxes/perea-beach1.dds" Name="SKYBOX_BEACH"/>
        <ResourceFile Path="data/models/oil/oil.DAE" Name="OIL.DAE"/>
      </Data>
    </Resource>
  </PropertyGroup>
</Demo>
